{
  "$schema": "./credential-registry.schema.json",
  "version": "0.3.0",
  "owners": [
    "user",
    "team",
    "organization",
    "platform",
    "local_open_source"
  ],
  "permission_classes": [
    {
      "id": "read_only",
      "description": "Search, fetch, inspect, and summarize without changing external state."
    },
    {
      "id": "draft_only",
      "description": "Generate content locally without an external side effect."
    },
    {
      "id": "write_nonfinal",
      "description": "Create a reversible draft, branch, issue, document, or configuration."
    },
    {
      "id": "final_submit",
      "description": "Publish, submit, approve, or otherwise finalize work on an external system."
    },
    {
      "id": "wallet_or_paid_action",
      "description": "Sign, deploy, transfer, spend credits, or invoke a paid external action."
    }
  ],
  "credential_classes": [
    {
      "id": "no_secret",
      "label": "No secret",
      "risk": "low",
      "default_behavior": "Enable public/local capabilities without optional accounts after required Colosseum setup, or for explicitly requested limited/offline work.",
      "storage_policy": "Store no credential."
    },
    {
      "id": "api_token",
      "label": "Scoped API token",
      "risk": "medium",
      "default_behavior": "Request only for a named capability whose documented access requires it; start with read-only scope and obtain authorization for any write capability.",
      "storage_policy": "Use a host secret mechanism, encrypted server-side storage, or private local storage. ProofPilot setup uses a mode-600 local credential file; never place tokens in prompts, URLs, logs, argv or frontend state."
    },
    {
      "id": "oauth",
      "label": "OAuth connection",
      "risk": "medium",
      "default_behavior": "Prefer read-only, short-lived scopes and show the requested permissions before connection.",
      "storage_policy": "Encrypt refresh tokens server-side and support revocation."
    },
    {
      "id": "service_identity",
      "label": "Organization service identity",
      "risk": "high",
      "default_behavior": "Use only for an organization-owned integration with an explicit resource boundary.",
      "storage_policy": "Keep in an organization secret manager with rotation, audit logs, and least-privilege policy."
    },
    {
      "id": "paid_api",
      "label": "Paid API credential",
      "risk": "high",
      "default_behavior": "Use only an authorized allowance within its quota. Explain expected charges and obtain scoped authorization before a paid or overage action; reuse authorization already given within its bounds.",
      "storage_policy": "Encrypt server-side, apply quotas and spending limits, and keep secrets out of job payloads."
    },
    {
      "id": "wallet_session",
      "label": "External wallet session or delegated signer",
      "risk": "critical",
      "default_behavior": "Keep disabled until the user approves a specific action, network, asset, and maximum amount.",
      "storage_policy": "Never ingest a private key or seed phrase. Use external signing, short-lived delegated sessions, or an isolated development wallet."
    }
  ],
  "prohibited_inputs": [
    "wallet_private_key",
    "seed_phrase",
    "mnemonic",
    "raw_secret_in_chat"
  ]
}
